id,icon,title,description,price
1,💨,Liquid Freebase & Saltnic,"Koleksi liquid terlengkap dengan berbagai varian rasa fruity, creamy, hingga tobacco. 100% berpita cukai resmi.",Mulai Rp 65.000
2,🔋,Pods & Mods,"Pilihan device lengkap mulai dari Pod System yang praktis hingga Mod bertenaga besar untuk cloud chaser. Garansi resmi.",Mulai Rp 150.000
3,⚙️,Coil & Cartridge,"Suku cadang original dari berbagai merk terkemuka agar performa device Anda selalu optimal dan rasa liquid tetap bold.",Mulai Rp 35.000
4,☁️,Kapas & Kawat,"Bahan wicking premium untuk Anda yang suka bereksperimen dengan setup RDA/RTA. Menghasilkan flavor yang bersih.",Mulai Rp 20.000
5,🔌,Baterai & Charger,"Baterai high-drain tahan lama dan charger eksternal original untuk menjaga keamanan & performa device Anda.",Mulai Rp 80.000
6,🛠️,Coiling & Wicking Service,"Jasa build coil dan wicking oleh Vapista berpengalaman kami untuk hasil yang rapi dan setup rasa maksimal.",Mulai Rp 15.000
7,🎒,Lanyard & Pouch,"Aksesoris pelengkap untuk membawa device Anda dengan lebih bergaya dan aman saat bepergian.",Mulai Rp 25.000
8,🧰,Tool Kit,"Set perlengkapan lengkap bagi Anda yang ingin belajar mem-build coil sendiri di rumah.",Mulai Rp 120.000
